username,link,mention,tweet_date,tweet_time,retweets,favorites,mentions
hanuniva_DMC,https://twitter.com/hanuniva_DMC/status/1178339664274419713,안녕하세요...오랫만입니다...별건아니고...근황이나 올리러 왔습니다 딴겜 열심히하고잇구요... 원래 좀 연어처럼 사는 사람이라 데메크를 거슬러 올라 다이에이를 다시 보더니 거기에 갑자기 꼬라박혀있네요.... 다들 또 태풍 올라온다는데 몸조심하시고..곧 환절기니 감기 조심하세요... pic.twitter.com/NZ6TBESkRl,2019-09-29,16:04:03,0,0,
younmeblues,https://twitter.com/younmeblues/status/1178339538092978176,"어쩌다 같이펀딩 프로그램에 관한 얘기를 들었다. 다른 소재는 별로 내키지 않았는데 유인나 씨의 오디오북 소재가 맘에 들어 출연분이 포함된 4~7회 중에서 빨리감기 해가며 인나씨 분량만 보려고 했는데, 첫 등장인 4회가 미처 끝나기도 전에 걸리 두 병을 비웠다. 이 프로그램 완전 술귀신이네.",2019-09-29,16:03:33,0,0,
kimsidaekiller,https://twitter.com/kimsidaekiller/status/1178339333184507904,#살면서_아프거나_다쳐본_경험 골절: X 수술: 다래끼... 쌍코피: X 독감: O 다래끼: O 장염: O 깁스: X 화상: O 교통사고: X 결막염: X 식중독: X 위염: O 링거: O 뼈만튼튼하고.. 철마다 독감장염감기를 달고사는 허약한인간이 접니다,2019-09-29,16:02:44,0,0,
TOONGTOONG_GMDJ,https://twitter.com/TOONGTOONG_GMDJ/status/1178339331691274240,김형우 형 날씨가 많이 쌀쌀한데 감기 조심하고 따뜻한 방에 누워서 푹 쉬고 있었음 좋겠네 pic.twitter.com/bl4EZS11DN,2019-09-29,16:02:43,0,0,
taek_dialogue,https://twitter.com/taek_dialogue/status/1178339317841711104,"두통약, 수면제, 수면 유도제, 감기약, 몸살약, 소화제? 많아.",2019-09-29,16:02:40,0,0,
svtcarrot_526,https://twitter.com/svtcarrot_526/status/1178339302373122049,#살면서_아프거나_다쳐본_경험 골절: X 수술: X 쌍코피: X 독감: X 다래끼: O (애기 때) 장염: O 깁스: O (반깁) 화상: O...? 손가락에 작게 교통사고: X 결막염: X 식중독: X 위염: X 링거: X 난 잔병치레가 많았어 특히 환절기때 감기,2019-09-29,16:02:36,0,0,
jjinneu1204,https://twitter.com/jjinneu1204/status/1178339233913692160,생각해보니까 독감도 올해 걸려본게 처음이고 개웃김 나 감기는 밥먹듯이 걸리는데 입원하거나 그럴정도는 아님. 태어나서 딱 하루 입원해봤음. 요로결석 때문엨ㅋㅋㅋㅋㅋ 시금치랑 우유랑 같이 많이 드시면 안돼요(,2019-09-29,16:02:20,0,4,
j_j_e_o_n_g,https://twitter.com/j_j_e_o_n_g/status/1178339164355346432,"#살면서_아프거나_다쳐본_경험 골절: 수술: 쌍코피: (비염달구사는데,,상관없는가봐요; 독감: (감기달구사는데,,독감은안걸렸네요; 다래끼:(두번,,, 장염: 깁스: (손꾸락 화상: 교통사고: (유치원때 결막염: 식중독: 위염: 링거:",2019-09-29,16:02:03,0,0,
mang_ryang,https://twitter.com/mang_ryang/status/1178339159150170112,결렘 감기면서 뭔가 떡밥 가뭄에 콩나듯 나올거라고 생각했는데 내가 서있던곳이 콩밭이었던거예요.. pic.twitter.com/cY6MSALuII,2019-09-29,16:02:02,6,15,
RubyKhin3,https://twitter.com/RubyKhin3/status/1178339158797905920,오늘도 고생했어 곤이도 감기 걸리지 않게 조심해 잘 자요 사랑해,2019-09-29,16:02:02,0,0,
Kno_Clock,https://twitter.com/Kno_Clock/status/1178339089545695234,"새벽 1시. 늦은 시간입니다. 생각보다 공기가 차갑습니다. 점점 더 추워질테니 난방을 따뜻하게 하시거나, 옷을 더 두껍게 입으시는 것이 좋습니다. 감기에 걸리면, 당신도 곤란하지 않습니까.",2019-09-29,16:01:46,0,0,
NRITH_99,https://twitter.com/NRITH_99/status/1178339040082284544,"(네가 다가오자 살짝 무릎 굽혀 키 낮추어 준다.) ㄱ, 그래...? 조금 어지럽긴 하, 지만.., 이 정도는 참을 수 있어···, 저, 정말이야... (자칫 네가 감기에 걸릴까 걱정되어, 조금 뒤로 물러나곤 서툰 손길로 널 쓰다듬었다.) 감기 옮으면 ㅇ, 어떡해... 그런 건 시, 싫다고 했잖아, 응...?",2019-09-29,16:01:34,0,1,
noxpesxr,https://twitter.com/noxpesxr/status/1178339017932148736,예쁜 밤 좋네. 눈 감기 전까지 같이 있어줘.,2019-09-29,16:01:29,0,0,
Siori__Violet,https://twitter.com/Siori__Violet/status/1178338976907743232,오전 한 시. 눈이 감기기 시작해 안으로 들어왔다. 창 안으로 들어오는 달빛의 색은 창백한 푸른색. 이어폰을 끼고 잠에 든다. 고요한 방과 달리 시끄러운 음악 소리가 새어나왔다. 우울이 스며들 자리는 없었다.,2019-09-29,16:01:19,0,0,
summer_mode4,https://twitter.com/summer_mode4/status/1178338974785368064,완전 다른데? (네 웅얼거리며 키득이며 물기가 거의 없어질때까지 말려주고 나서야 손을 뗐어)그냥두면 감기걸리잖아~ 그럼 엄청 속상할거야 (주변도 주변이지만 특히 내가 제일 속상할거야 은호야. 눈을 감고 제 손에 맡기는 너에게 당장이라도 입을 맞추고 싶었지만..,2019-09-29,16:01:18,0,0,
Sodaning_owo,https://twitter.com/Sodaning_owo/status/1178338956640845825,으으으..... 감기약 먹어서 괜찮았옸는데 감기 바이러스가 더 강해져서 ㄴㅏ 괴롭혀,2019-09-29,16:01:14,0,0,
DEAN_1GObot,https://twitter.com/DEAN_1GObot/status/1178338948361281536,감기 조심해.,2019-09-29,16:01:12,0,0,
Eight_JH,https://twitter.com/Eight_JH/status/1178338908465033216,"(당신의 눈치를 살피다 자신도 다리를 깔고 바닥에 앉았다. 이어지는 물음에 고개를 끄덕였고.) 어릴때부터 추위에 약했어요. 근데 신기하게 겨울에 한 번도 감기에 걸린 적은 없었어요. (고개를 올려 하늘을 바라보았다. 시선을 하늘에 고정시킨 채로,) 이름 물어봐도 돼요?",2019-09-29,16:01:02,0,0,
HEW_FF14,https://twitter.com/HEW_FF14/status/1178338851980361728,아... 감기 죽겟다.... 아까 7시쯤에 맥주한캔 마셨는데 감기약먹는거 에바인가요,2019-09-29,16:00:49,0,1,
LinNOne_87,https://twitter.com/LinNOne_87/status/1178338803158642694,수고많았어요 감기 조심,2019-09-29,16:00:37,0,0,
MOGU_HOLIC,https://twitter.com/MOGU_HOLIC/status/1178338774306054145,#살면서_아프거나_다쳐본_경험 골절: X 수술: X 쌍코피: X 독감: X 마취:X 깁스: X 화상: X 식중독: X 위염: X 링거: ㅇ 발톱제거: X 호흡곤란: X 나 존나 건강하지 링거 맞은것도 입원한게 아니라 그냥 감기땜에 한두시간 맞아본게 끝임,2019-09-29,16:00:30,0,0,
kb119112,https://twitter.com/kb119112/status/1178338735458414593,감기걸려서 맛이 안느껴져요 헬프미,2019-09-29,16:00:21,0,0,
1am_Th3_B3st,https://twitter.com/1am_Th3_B3st/status/1178338716718223360,나 감기걸림. 내 감기 받을 사람?,2019-09-29,16:00:17,1,1,
kosanghun,https://twitter.com/kosanghun/status/1178338622564552705,자유한국당이 이번 촛불집회로 적잖이 당황하고 배가 아픈 모양이다. 그럴거 없잖아. 느그들도 저정도 모여서 200만이라고 하면되잖아. 10월 3일 모인다며 느그들의 능력을 보여줘. ㅋㅋ 근데 어쩌나 개천절에 태풍온단다. 우비 꼭 챙겨입고하고 동원된 어르신들 감기 안걸리게 유의하고. 화이팅! ㅋㅋ pic.twitter.com/4Ez3VaVblP,2019-09-29,15:59:54,1,2,
IFT_169,https://twitter.com/IFT_169/status/1178338558102261760,시험기간에 감기 개실타,2019-09-29,15:59:39,0,0,
Honak_one,https://twitter.com/Honak_one/status/1178338534698045441,저번주에 코감기목감기 죄다 걸려서 걸어다니는 시체처럼 나녔는데 토욜날 푹쉬니까 이제 코풀때 시원함을 느껴 이게 삶의 놕이지,2019-09-29,15:59:33,0,0,
va__zz,https://twitter.com/va__zz/status/1178338473998073858,기침 근데 감기아니라도 가끔 터지면 숨못쉬어서 눈물날때까지 계속 하다가 어느순간 확 괜찮아질때있는데 이걸그냥 기침잭팟이라고 부르고잇어요 한달에 몇번 있는 이벤트(???????),2019-09-29,15:59:19,0,0,
fsGKvsZvZ0UyQ2p,https://twitter.com/fsGKvsZvZ0UyQ2p/status/1178338428133363713,오늘 무슨 취향 발굴의 날인가 권태기까지 감기다니 미쳤네 권태기 비유 미친 부분들 은행잎에 상처에 어떻게 이런 생각을 하시지 권태기 생겨보는 것도 좀 괜찮을 거 같아...ㅠㅠㅠㅠㅠ pic.twitter.com/XR7hdhzYLM,2019-09-29,15:59:08,3,5,
myymindness,https://twitter.com/myymindness/status/1178338423968370690,코 훌쩍훌쩍 목 따끔따끔 머리 지끈지끈 하는거 보니까 역시 환절기답게 감기님이 오시나봐요... 오라는 주인님은 안 오시고... 왜 감기님이 먼저 등판하시는거죠....? 트친넴들은 꼭 감기 조심하세요! 아프면 서럽잖아요,2019-09-29,15:59:07,0,15,
aTTi__aTTi,https://twitter.com/aTTi__aTTi/status/1178338382805553152,감기약 때문에 배고픔 느낄 새도 없이 너무 졸려서 기절하니까 편하긴 한데 컨디션이 별로야,2019-09-29,15:58:57,0,0,
S2va___,https://twitter.com/S2va___/status/1178338341953003520,아글고 뭐냐... 블언블 편하게 해주시구요 저는 오늘 암말계 좀 있다ㅜ가보도록 허겟습니다 감기조심하세용,2019-09-29,15:58:47,0,0,
pecokakia,https://twitter.com/pecokakia/status/1178338341952970752,펠님두 환절기 감기 조심하구 ㅠㅠ 흑흑 아니예용 저두 ㅋㅋㅋ 이 계정 잘 오지도 않았구 그랬는걸..흑흑 ㅠㅠ)S2,2019-09-29,15:58:47,0,1,
wlzlf65,https://twitter.com/wlzlf65/status/1178338326677344256,골절이런거랑은 상관 없고 위염 비염에 감기랑 중이염이 제일 연관성 높은사람...,2019-09-29,15:58:44,0,0,
vxvxvx_r1_02_6,https://twitter.com/vxvxvx_r1_02_6/status/1178338295849205760,이은상 빨리 셔츠 여며 감기 걸릴라 pic.twitter.com/xPsHger7ff,2019-09-29,15:58:36,0,0,
Akyulli,https://twitter.com/Akyulli/status/1178338260411670535,저.. 카레도 좋아하고.. 아침상도 좋아하고... 마법사친구가 고양이 되는것도 좋아하고... 마법사감기 시날도 좋아함... 나.... 개그 시날 좋아(?),2019-09-29,15:58:28,0,1,
DS_dasom_,https://twitter.com/DS_dasom_/status/1178338238102032385,몸살감기났는데 갑자기 연성하고싶어서 급히 타블렛 꺼내는 중;,2019-09-29,15:58:23,0,2,
xinyoo1207,https://twitter.com/xinyoo1207/status/1178338135257665537,하하하하 귀엽네요 우리 소은이 도 감기 조심하세요!,2019-09-29,15:57:58,0,0,
som_Tobot,https://twitter.com/som_Tobot/status/1178338108640620544,몸살감기났는데 연성하고싶어서 타블렛 끄집어 냄..,2019-09-29,15:57:52,0,1,
bboni_0106,https://twitter.com/bboni_0106/status/1178338101724213248,유럽은 한국보다 추울거니까 꼭 따뜻하게 입으라고 사줬더니 진짜 챙겨가셨네....¡¡ 감기 걸리기만 해 ... pic.twitter.com/uQcaucIuEm,2019-09-29,15:57:50,0,10,
wol_lmcn,https://twitter.com/wol_lmcn/status/1178338028571357184,맞아ㅋㅌㅋㅌ 그래서 긴가민가했는데 맞았어서 흐뭇하당 환절기인데 감기 조심하구 건강하기ㅠㅠ)9 S2 오랜만에 안부 묻는 것 같아서 민망하네 ㅋㅋㅋ ㅠ,2019-09-29,15:57:33,0,0,
Cloud_Jaehwan,https://twitter.com/Cloud_Jaehwan/status/1178337941279502336,이제보니 재환이 안녕깅 영상 이만큼 올릴라 했는데 많이 잘려버렸네요 (내목소리 지우고싶다 너무 거슬려 들을수록 감기걸린 목소리다된거봐 따흑 pic.twitter.com/quFf4e822K,2019-09-29,15:57:12,0,4,
suhoking0,https://twitter.com/suhoking0/status/1178337919532068866,감기조심해라,2019-09-29,15:57:07,0,0,
coupsyang0808,https://twitter.com/coupsyang0808/status/1178337897331642368,계속 재채기하는데 이건 감기맞죠?ㅋㅋㅋㅋ,2019-09-29,15:57:01,0,0,
va__zz,https://twitter.com/va__zz/status/1178337864242720768,감기 코감기는 잘 안 걸리는데 걸리고나면맨날 기침을 곧죽을애처럼해서 진심으로 걱정받는데사실그냥감기라서괜찮음,2019-09-29,15:56:53,0,1,
iTuEhXOL9TeDpDz,https://twitter.com/iTuEhXOL9TeDpDz/status/1178337749222297600,수고했어~ 피곤할텐데 감기조심하자.,2019-09-29,15:56:26,0,1,
Rapi__d,https://twitter.com/Rapi__d/status/1178337728821223424,절대 스파허브 해 감기 걸린 스파 돌봐주는 허브!!!! 섬세하고 다정한 손길에 열이 내리기는 커녕 체온 더 올라가는 스파 (허브:???),2019-09-29,15:56:21,0,2,
LeeHigh_bot,https://twitter.com/LeeHigh_bot/status/1178337724010356736,무슨 소리야! 감기가 만병의 근원이라면! 살짝 베인 상처조차 저세상의 근원이 될 수 있을지 없을지 어떻게 알겠어! 내가 무슨 말을 하고 있는걸까?! 여하튼 왠지 그런 기분이 들어!,2019-09-29,15:56:20,0,0,
cherr_y_ooo,https://twitter.com/cherr_y_ooo/status/1178337638429802497,엽이는 감기 걸리지마.. 환절기 감기 조심,2019-09-29,15:56:00,0,0,
GJ_INGAN,https://twitter.com/GJ_INGAN/status/1178337632058662913,휴..감기도 일년에 한드번 걸릴까말까 하지만 좀 자주 넘어져여 흉터는.. 한두개잇지여,2019-09-29,15:55:58,0,0,
nuyanim,https://twitter.com/nuyanim/status/1178337620184588288,"결국 누야는 쓰러지고 ㅋㅋㅋ 롤루는 감기 걸리면 안대,,",2019-09-29,15:55:55,0,0,
Akyulli,https://twitter.com/Akyulli/status/1178337615050788868,감기시날.. 뭐 이런게 다 있지 싶은데 되게 좋아하고 있는 나를 보았다,2019-09-29,15:55:54,0,1,
cherr_y_ooo,https://twitter.com/cherr_y_ooo/status/1178337530833293314,어우씨 감기 좀 떨어져 제발 ㅜㅜ 헤어져 ㅜㅜ,2019-09-29,15:55:34,0,0,
cherr_y_ooo,https://twitter.com/cherr_y_ooo/status/1178337474583465984,제 소중한 감기 무나합니다 선착순 한명 (그아없),2019-09-29,15:55:21,0,0,
slaveof_mark,https://twitter.com/slaveof_mark/status/1178337396418433024,독감예방접종대신 보는 영상 소개합니다 평생 감기의 ㄱ도 모르고 살았다네요 ? pic.twitter.com/bYs8Ge1V69,2019-09-29,15:55:02,808,705,
maltosOh,https://twitter.com/maltosOh/status/1178337382006845440,졸리고 감기기운있는데 갑자기 커뮤에서 돌발상황 벌어져서 깜놀함 pic.twitter.com/VCqxib8pte,2019-09-29,15:54:58,0,1,
ejqmfzmfhtmgkwk,https://twitter.com/ejqmfzmfhtmgkwk/status/1178337372586405889,감기시날이라구 저두 이상한시날 들고잇답니다 (헛된공수표남발하며,2019-09-29,15:54:56,0,2,
YourDream_space,https://twitter.com/YourDream_space/status/1178337362578817024,잘 지냈어-? 요즘 날씨가 많이 일교차가 심해서 감기 걸리기 쉬웠을텐데..괜찮아-? (네 볼을 쓰다듬어주면서),2019-09-29,15:54:54,0,0,
A_C0W3N_,https://twitter.com/A_C0W3N_/status/1178337354823520259,"정말? 정말 겨울마다 감기에 걸려? 이번 겨울에는 안 걸릴거야, 아마..도,",2019-09-29,15:54:52,0,0,
I99808I9,https://twitter.com/I99808I9/status/1178337351027716096,감기때문에 주글 것 가타,2019-09-29,15:54:51,0,1,
ji_cos_,https://twitter.com/ji_cos_/status/1178337341829570560,그치만 지금 그러면 감기 더 걸릴것같아><,2019-09-29,15:54:49,0,0,
MKLOVE1116,https://twitter.com/MKLOVE1116/status/1178337222891720704,근데 목소리 코맹맹한데.. 감기 걸린거 아녀ㅠㅠ,2019-09-29,15:54:21,0,0,
rainer_DLC,https://twitter.com/rainer_DLC/status/1178337165043855361,"천천히 쇼파에서 무거운 몸뚱이를 일으켜 세웠다. 아무래도 감기가 결국 좋은 꼴을 보지 못했던거 같다. 빨리 끝내고 쉬고 있었다. 지금은 그런 생각뿐,",2019-09-29,15:54:07,0,0,
Castle__duck,https://twitter.com/Castle__duck/status/1178337135079780352,내맘대로 생각한 건강하면 성덕미지만 잘 아프지 않은 건 맞으니까. 지금은 감기 다 나은 거지?,2019-09-29,15:54:00,0,0,
dearmydreamiz,https://twitter.com/dearmydreamiz/status/1178337124547842048,내 인생 제일 어이 없었던 순간 감기 걸렸는데 다음 날 콘서트라서 엄마가 진짜 갈 수 있겠냐고 갔다와서 더 아픈 거 아니냐고 엄청 걱정했는데 스탠딩에서 엔시티 실물 보고 발광하다가 콘서트장 나왔는데 감기가 다 나음ㅎㅋㅎㅋㅎㅋㅎㅋㅋㅋㅋㅋ,2019-09-29,15:53:57,0,2,
xinyoo1207,https://twitter.com/xinyoo1207/status/1178337071858999296,감기는 언제 나을까요ㅠㅠㅠㅠ 곧 우리 윜밐 만나거에요 학국어 도 열심히 공부해야지~~~~ 나랑 한글로 대화하는 연습할 사람 있어용?,2019-09-29,15:53:45,0,1,
purplealice1,https://twitter.com/purplealice1/status/1178337044642308109,감사합니다 환절기 감기 조심하세요,2019-09-29,15:53:38,0,0,
mu_tlapf2,https://twitter.com/mu_tlapf2/status/1178336954754072577,진짜 웃기지아너요 약냉방칸인데 누가 말햇는지 갑자기 에어컨을 쎄게 튼거야 그리고 직빵으로 맞앗지 그리고 감기에 걸리고 눈알러지가 돋아버린거야,2019-09-29,15:53:17,0,2,
RosyNa_or_NaNNa,https://twitter.com/RosyNa_or_NaNNa/status/1178336946663247873,"오늘 무인하는데 막공소감 다른 사람들 다 막 그동안 고생했고 감사하다 이런 말로 시작하는데... 내 본진 세상 당차게 ""태풍 옵니다, 비 맞지 마시구요. 감기 조심하시구요."" 이래서 '뭐라구요....?' 상태 돼버림ㅋㅋㅋㅋ 좋은 말인건 맞는데 지금 여기서요??? ㅋㅋㅋㅋ",2019-09-29,15:53:15,0,10,
purplealice1,https://twitter.com/purplealice1/status/1178336820947542017,주말동안 푹쉬었다니 이제 많이 괜찮아요 따수운 쁘렝님 감사해용~ 모두 감기조심! #TheConcertTour #LoveYourselfSpeakYourself #PCAs @BTS_twt,2019-09-29,15:52:45,0,0,@BTS_twt
byul_kok_3822,https://twitter.com/byul_kok_3822/status/1178336820024659968,"#살면서_아프거나_다쳐본_경험 골절: 6살 때 어깨 수술: ㄴ 쌍코피: 어릴 때 독감: 초2~4? 때 다래끼: 3번? 장염: 초2, 저번 달쯤 의심 깁스: 초3 때 다리 화상: 햇빛 땜에 교통사고: 초3 때 자전거 타다가 결막염: 환절기에 일상 식중독: ㄴ 위염: ㄴ 링거: 작년에 감기 걸려서",2019-09-29,15:52:44,0,3,
FLS2RENCE,https://twitter.com/FLS2RENCE/status/1178336811484999680,"방심은 언제나 좋지 않죠. 그런 대답을 들으니 마음이 놓이네요. 오, 저는 겨울마다 감기에 걸리곤 하는데 이번엔 특히 더 조심해야겠군요.",2019-09-29,15:52:42,0,0,
cu_te_cat,https://twitter.com/cu_te_cat/status/1178336785782300680,저 ㄹㅇ 갸심심한데 감기 걸려가지고 코 맥혀서 잠도 안오고... 근데 할 건 없고... 이러던 중이였음요,2019-09-29,15:52:36,0,1,
LOTTE_plz_WIN,https://twitter.com/LOTTE_plz_WIN/status/1178336785463566339,#살면서_아프거나_다쳐본_경험 골절: X 수술: X 쌍코피: O 독감: 아마 X 다래끼: X 깁스: X 화상: O 교통사고: X 결막염: 아마 X 식중독: X 위염: O 링거: O 어릴 때 폐렴 심하게 걸려서 입원했었고... 무리하면 바로 감기몸살이 몸을 후드려패는 사람,2019-09-29,15:52:36,0,0,
Eight_JH,https://twitter.com/Eight_JH/status/1178336782808580097,"반가워요. (근처를 어슬렁거리다 당신을 발견하고, 작게 웃었다.) 산 속은 밤과 새벽에 기온이 내려가니까요. 여기서 감기에 걸리면 큰일이니 조심해요. 근처에 병원도 없는 것 같던데.",2019-09-29,15:52:36,0,0,
sotanayo,https://twitter.com/sotanayo/status/1178336772259860480,"진짜 머리 감기 너무 귀찮은데 내가 아침의 나를 위해서 특별히 감아준다,,,,,,,,",2019-09-29,15:52:33,0,2,
manggi_moon,https://twitter.com/manggi_moon/status/1178336763355353088,아 미친감기 또 열오른다 미친 하루에 몇번씩 난리를 치는거야 대체,2019-09-29,15:52:31,0,4,
Tony_astronaut,https://twitter.com/Tony_astronaut/status/1178336707780808706,"감사합니다,. 언제 함 보고 싶은 레페로님인디...ㅠㅠ 감기 조심하세요 ㅠㅠ",2019-09-29,15:52:18,0,1,
killua_yan_bot,https://twitter.com/killua_yan_bot/status/1178336583608496128,어제밤에도 이불을 걷어차더니 감기안걸리게 조심해.,2019-09-29,15:51:48,0,0,
laugh_mango,https://twitter.com/laugh_mango/status/1178336583193255936,감기 씨게 걸렸나보네..... 숨 안쉬어지고 난리,2019-09-29,15:51:48,0,1,
Yoowoo_Foryou,https://twitter.com/Yoowoo_Foryou/status/1178336570119618560,"으아아,춥다...감기,감기조심해!",2019-09-29,15:51:45,0,0,
Marronnn_,https://twitter.com/Marronnn_/status/1178336457334771713,감기약 먹 맥주 말,2019-09-29,15:51:18,0,0,
Nehren_IV,https://twitter.com/Nehren_IV/status/1178336417400918018,해열제하고 감기약 먹었는데듀 머리 아파,2019-09-29,15:51:08,0,0,
DoEun_3_3,https://twitter.com/DoEun_3_3/status/1178336363407540230,그러려고 ㅜㅜㅜ 일단 감기걸렸는데 치과 가야해서 감기약먹고 치과 갔다가 저녁에 다시 일 가야지... 터덜ㅋ... ㅋㅋㅋㅋㅋ 이번달 돈 많이 벌듯 ^^......,2019-09-29,15:50:56,0,0,
Myungmyung_123,https://twitter.com/Myungmyung_123/status/1178336349138481152,여러분 감기 조심해요..,2019-09-29,15:50:52,0,1,
A_C0W3N_,https://twitter.com/A_C0W3N_/status/1178336248290611201,"매일 방심하면 그것도 안 좋다고 하던데... 일단 최대한 감기에 걸리지 않게 노력해볼게, 대신 선배도 감기에 걸리지 않았으면 좋겠어!",2019-09-29,15:50:28,0,0,
hi_kar_ii,https://twitter.com/hi_kar_ii/status/1178336233333772289,감기때매 코막혀서 짜증난다!,2019-09-29,15:50:25,0,4,
_space_debris,https://twitter.com/_space_debris/status/1178336227021344768,"부끄럽잖아요 ,, , 제가 아무리 환절기때마다 ,, 조지게 재채기를 해도, ,매일 감기약을 먹어야,, 하루를 불편하지 않게 보내도. , 비염이 아닐수도있잖아요,,",2019-09-29,15:50:23,0,0,
Myungmyung_123,https://twitter.com/Myungmyung_123/status/1178336114660102144,ㅠㅠㅠㅠ오전에 응급실 가서 링겔 맞았는데도ㅠㅠㅠㅠㅠㅠ 다시 열올라서 죽을거 닽아요ㅠㅠㅠㅠㅠ 감기 죠심해오....,2019-09-29,15:49:56,0,0,
siawase_otaku,https://twitter.com/siawase_otaku/status/1178336113942884353,두근거리네요... 계폭튀에 감기다,2019-09-29,15:49:56,0,0,
5bpen,https://twitter.com/5bpen/status/1178336099006943233,흑흑 알겟어요...벨라 가슴 열어둬서 감기걸리면 안되는데(훌쩍 루이사가 뜨겁게 안아줫다구 믿을게여...,2019-09-29,15:49:53,0,0,
loveattack10051,https://twitter.com/loveattack10051/status/1178336004609961984,감기 걸려서 목소리 안나왔는데도 놀아주셔서 감사합니다 콘때마다 아픈것 같고 .... 쩝,2019-09-29,15:49:30,0,1,
Ha_neul0603,https://twitter.com/Ha_neul0603/status/1178336002642890752,오늘은 끝까지 있지 못해서 미안해요 병원에 다녀왔습니다 이제부터 천천히 하겠습니다 오빠도 빨리 감기 낫기를... 한 달 동안 감사했습니다,2019-09-29,15:49:30,0,0,
N0_thinking,https://twitter.com/N0_thinking/status/1178335980790501377,감기걸리셨어요?,2019-09-29,15:49:24,0,0,
ydbmmm,https://twitter.com/ydbmmm/status/1178335965674229761,감기 오지게 잘 걸리고 오지게 잘 안 나음.. ((기관지가 안 좋아서,2019-09-29,15:49:21,0,1,
ydbmmm,https://twitter.com/ydbmmm/status/1178335963895828481,#살면서_아프거나_다쳐본_경험 골절: ㅇ 몇번이더라 수술: 어릴때 폐렴으로 쌍코피: 초딩때 1번 독감: 몰라 다래끼: 작년에 한번 장염: ㄴ 깁스: 좀 뽀가져봣지 화상: ㄴ 교통사고: ㄴ 결막염: ㄴ 식중독: ㄴ 위염: ㄴ 링거: ㄴ 뽀가진거 골절된거 말곤 별로 없음 .. 독감대신 감기 잘 걸림,2019-09-29,15:49:20,0,4,
machatmavie,https://twitter.com/machatmavie/status/1178335907084038144,아 제발 콧물만 좀 멈췄으면 좋겠다... 목도 아프고 머리도 아프고 재채기 기침에 눈물도 줄줄 흐르고 무슨놈의 감기가 진짜...,2019-09-29,15:49:07,0,5,
FLS2RENCE,https://twitter.com/FLS2RENCE/status/1178335891644747776,곰... 곰도 감기에 걸릴 수 있죠. 방심은 안 돼요.,2019-09-29,15:49:03,0,0,
A_rhetoric,https://twitter.com/A_rhetoric/status/1178335828877008898,감기 독감 너무 자주 걸려,2019-09-29,15:48:48,0,3,
ChunHyang_CM,https://twitter.com/ChunHyang_CM/status/1178335825840365569,"살려져 살려져 ㅠㅠ 졸려 뒤질거같은데 나 오늘 공부 해야되 안하면 진심 내 시험이고뭐고 멘탈 나감 근데 감기 때문에 정신 몽롱함 진심; 어이 없다,, 감기 안 걸리다가 왜 걸리냐 김춘향, , ,,,",2019-09-29,15:48:47,0,0,
Bok_hee_39,https://twitter.com/Bok_hee_39/status/1178335818261254144,"-..아 아니 너 뭐해, -뭐하긴요 패딩 자크 올려주는 거지 -아니, 그러니까 그걸 왜 해.. -감기 걸리면 안되니까? 모자까지 꼼꼼하게 씌워주고 팔 내린 윤이 국이랑 눈 맞추고는 가볍게 입꼬리 올려서 웃는데, 국 또 그런다 아까 그 이상한 기분 눈동자 안으로 빨려들어가는 기분",2019-09-29,15:48:46,0,0,
jjubea_,https://twitter.com/jjubea_/status/1178335769049518080,감기몸살 각이다,2019-09-29,15:48:34,0,0,
_space_debris,https://twitter.com/_space_debris/status/1178335762963582976,"근데 뭐,, 감기같은 걸로는 병원에 안가기도 하고,, 비염치료도,, 병원에 갔는데 비염이 아니면 부끄러우니까,, 이 얘기할때마다 가족들 속터져 죽을라고함,, 그치만 부끄럽잖아,,",2019-09-29,15:48:32,0,0,
