username,link,mention,tweet_date,tweet_time,retweets,favorites,mentions
97_1_d,https://twitter.com/97_1_d/status/1178216268131778560,"예쁜데 감기걸려,,,,",2019-09-29,07:53:43,0,0,
sh__OOO528,https://twitter.com/sh__OOO528/status/1178216176482054144,감기는....매일 달고살지만....괜차나요!!!,2019-09-29,07:53:21,0,0,
thgnl9137,https://twitter.com/thgnl9137/status/1178216161017597957,"애기때는 사랑이라는 감정도 모르고 해서.. 루슈 볼 때마다 가슴 두근거리고 열나는 게 감기때문이라고 생각하고ㄲㅋㅋ 결국에는 루슈 앞에서 ""너만 보면 감기가 걸리잖아..!!"" 이럴듯ㅋㄲㄱㅋ",2019-09-29,07:53:17,0,1,
Green_hia,https://twitter.com/Green_hia/status/1178215973595172865,괜찮을 거에요!!!!감기로 쓰러진 적은 없으니까요!!!,2019-09-29,07:52:32,0,0,
kimmariiiii,https://twitter.com/kimmariiiii/status/1178215962291490816,매일매일 먹기시작하고서부터 틈만나면 걸리던 기관지염이 싹 사라진거랑 감기 없이 이번 여름도 무사히 보냈다! 배탈도 사라졌고요~ pic.twitter.com/6RLpOQen2Y,2019-09-29,07:52:30,0,11,
FD_BoBo,https://twitter.com/FD_BoBo/status/1178215934395207680,덩치 큰데 자꾸 주인품으로 파고드는거 너무 좋구...엉덩이는 빵실 탄탄해서 때리기좋고 허리는 얇아서 손으로 감기좋았으면 좋겠어 가슴도 크면 너무 좋고,2019-09-29,07:52:23,0,1,
Stsd_ois,https://twitter.com/Stsd_ois/status/1178215820058484736,이이날시에 선풍기를 틀고잔다구요 새얀님 강한 사람이야... 감기 걸릴만 했네요 ㅠ 네??..?. 럽님도 그렇구 두 분 다 제 그림 어디 걸어두시려고.... pic.twitter.com/mnTllZlHRI,2019-09-29,07:51:56,0,1,
fxxx_me_plz,https://twitter.com/fxxx_me_plz/status/1178215668883148800,이상하게 오늘따라 아프네. 감기 걸린건가. 약이라도 좀 사줄래? @RT_FORMALE,2019-09-29,07:51:20,1,1,@RT_FORMALE
murphy_over,https://twitter.com/murphy_over/status/1178215665397686272,감기조심하세요 여러분.... - 온몸 뽀사질것같은데 출근해야돼서 개빡친 개구리 올림 -,2019-09-29,07:51:19,0,17,
KLAVIERwerke___,https://twitter.com/KLAVIERwerke___/status/1178215508287442949,오늘 시험 전날 마지막 레슨+반주인데 감기걸려서 내일 그냥 조지고 쪽당하고 오지나 않으면 다행일듯,2019-09-29,07:50:42,0,1,
mosquito__mogi,https://twitter.com/mosquito__mogi/status/1178215455351164928,감기약 진짜 졸려 짜증나 수행해야되는데 졸려,2019-09-29,07:50:29,0,0,
love_gdhs,https://twitter.com/love_gdhs/status/1178215452377436160,감기기운 심해져서 자고 일어남... 아 감기걸리면 오래가는데,2019-09-29,07:50:28,0,2,
Sucha_Lime,https://twitter.com/Sucha_Lime/status/1178215333057851392,일교차 심한 것 같아... 감기 조심해 ;-;,2019-09-29,07:50:00,0,0,
rbc_max_,https://twitter.com/rbc_max_/status/1178215185179267072,악마라니 하긴 날 존나 감기게햇으니 악마가 맞다 https://twitter.com/noideaatall0927/status/1178214047054848000 …,2019-09-29,07:49:24,0,0,
Moneary,https://twitter.com/Moneary/status/1178215137087348736,졸려서 눈감기는데 자고싶지않음,2019-09-29,07:49:13,0,0,
byeolchan0107,https://twitter.com/byeolchan0107/status/1178215086688653312,우리 클리부가 이런 이쁜모습들 잔뜩보여줬는데 이번주 내내 감기에 시달렸더니 재대로 이뻐해주지도못하구 뽀뽀도못해주고..8ㅅ8 오늘 잘자구 잘보내구 있었어요 클리부?8ㅅ8,2019-09-29,07:49:01,0,0,
mandy_pic,https://twitter.com/mandy_pic/status/1178215083798720512,삼반장 중에서 실은 젤 첨에 눈에 들어왔던 애가 클로드ㅋㅋ.. 그런데 디iㅁi레스에 감기고 금사슴이 좀 진상에 제일 근접했다고 들어서 미루다가 오늘이다,2019-09-29,07:49:00,0,0,
kinkang_sweet,https://twitter.com/kinkang_sweet/status/1178214938298347520,엄마랑 친구한테 감기걸린 초딩같다 들엇던거때문에... 올초부터는 목소리가 좋아진거같지만 여전히 목소리가 콤플렉스라서 말 안하려구 하는 경향잇음,2019-09-29,07:48:26,0,0,
your_Aggie,https://twitter.com/your_Aggie/status/1178214917645709312,"덮밥 같이 먹으러 가기로 꼭 약속했는데. 있지,애기 하트를 뺀 아이가 애기를 죽여야 자기의 목표를 이룰 수 있다고 그랬었어. 그래서 어쩔 수 없이 죽어버렸어. 정말 미안해..에단. 그래도 에단 곁에 계속 머무를테니까. 우리 푸티 잘 부탁하고,추우면 꼭 담요 꺼내서 써야해. 감기 걸리지 말고..응?",2019-09-29,07:48:21,0,0,
dreamjaduckstar,https://twitter.com/dreamjaduckstar/status/1178214859445432320,어아!!! 유세카나ㅠㅠㅠㅠㅠㅠ 감기 아 진짜 너무 대박이에요 둘이 이렇게 너무 아 카나타 유세이 이름 부르는 거랑 유세이 여기 있다고 진짜 너무 설레요ㅠㅠ 둘은 갓컾입니다 반박시 듀얼디스크 찬 채 자기 팔꿈치 핥기,2019-09-29,07:48:07,0,1,
kkomsuri,https://twitter.com/kkomsuri/status/1178214696786071553,흑흑 진짜 죽을 것 같아요... 시안님도 감기 조심하세요 걸리면 죽음뿐...,2019-09-29,07:47:28,0,1,
FF14_Noyeah,https://twitter.com/FF14_Noyeah/status/1178214695427133445,일행있음 제발 ㅌㄱㄱ 빨리 보고 빠졌음좋겠다....가뜩이나 감기때문에 죽것는데 40분째 길에서 서있으니 극대노....,2019-09-29,07:47:28,0,1,
lybjdjk,https://twitter.com/lybjdjk/status/1178214620495876096,이불이랑 베개들고 쪼르르 가서 황 옆에 누움 눕자마자 팔다리 감겨와서 괜한 짓 했나 후회하는 용뽀.... 근데 어둠속에서도 보이는 황 얼굴이 너무 행복하게 웃고있어서 괜히 간질간질한 마음으로 눈 감기 황 심장소리 두근두근 들리는것 같아서 괜히 가슴팍에 머리 콩콩 박고,2019-09-29,07:47:10,0,1,
newshephard,https://twitter.com/newshephard/status/1178214467714207744,맛없음 딸기맛 감기 시럽을 스펀지 케이크 위에 뿌린 맛 pic.twitter.com/2JSS3zfwGq,2019-09-29,07:46:33,0,6,
DarkP_egasus,https://twitter.com/DarkP_egasus/status/1178214408016683010,방해하지 말라고 했지 사슴박이! 비디오 한 편 다 봤으면 되감기해서 다시 보고 있어라!,2019-09-29,07:46:19,1,0,
2delight2,https://twitter.com/2delight2/status/1178214116571222016,목감기!!!,2019-09-29,07:45:10,0,0,
kimhunu_ATM,https://twitter.com/kimhunu_ATM/status/1178214097420091392,ㅇ(-( 집가서 또 감기약 먹고 좀 자다가 일어나서 빨래해야지,2019-09-29,07:45:05,0,1,
GyeongvelyU,https://twitter.com/GyeongvelyU/status/1178214094693732352,아 씻고 누워야대는데... 감기 개샛갸 나 주어니 투어 전까지 가라 진짜 더붙어잇으면 나 목메고 죽어버린다 ? pic.twitter.com/q9aR4e92Or,2019-09-29,07:45:04,0,1,
violarisse,https://twitter.com/violarisse/status/1178214043435192321,골골골골골골골골골골골골골골골골 (지나가세요 감기걸린 흔한 중생입니다,2019-09-29,07:44:52,0,1,
Soran_haring,https://twitter.com/Soran_haring/status/1178213998988124161,역시 어제 공연장에서부터 목이 이상하다 싶었는데 목감기였구나^^? 후 갑자기 더워진 날씨에 살짝쿵 찾아와버린 목감기라니..ㅎ,2019-09-29,07:44:42,0,0,
GradYamaOut_Oct,https://twitter.com/GradYamaOut_Oct/status/1178213989869703168,미친거아녀.. 공부 좀 쉬었다 해ㅜ 약먹고 좀 자.. 감기는 어제 괜찮은거 같아도 내일은 열 펄펄 끓는게 감기야 ㅃㄹ 쉬어ㅡㅡ https://twitter.com/puze18/status/1178211518522916864 …,2019-09-29,07:44:39,0,0,
DKWANT_218,https://twitter.com/DKWANT_218/status/1178213980080226304,감기라뇨 ㅠㅠㅠ 이따 조심히오세용 ㅠㅠㅠ8ㅅ8,2019-09-29,07:44:37,0,0,
Algorithm__S,https://twitter.com/Algorithm__S/status/1178213923872313345,"혹시 춥지는 않나요. 네, 저는 괜찮아요. 안희원 씨는요? 내가 우리 서윤 씨한테 그런 걸 걱정 받을 처지는 아닌 것 같은데. 그건 그렇지만요…. 추워지면 바로 말해요. 이 날씨에 감기라도 걸려서 일상생활이 성가셔지는 건 서윤 씨도 바라지 않는 일일 테죠. 네, 그쵸….",2019-09-29,07:44:24,0,8,
K08_GYS,https://twitter.com/K08_GYS/status/1178213801151254529,그나마 전화? 근데 요즘은 감기 때문에 전화 잘 안 받아.,2019-09-29,07:43:55,0,0,
L2vAble,https://twitter.com/L2vAble/status/1178213795614740480,밥 잘 챙기고 ... 맛있는 거 오천번 먹구 .... 독서실 시원해 ?? 요즘 날씨가 또 더워져 ... 그래도 감기 조심,2019-09-29,07:43:53,0,0,
maru__Ssul,https://twitter.com/maru__Ssul/status/1178213774223802368,"7-1. 주위에 감기 걸린 사람이 많아서 그런지 걱정이네요. 낮에 덥다고 반팔 입고 다니지 말구요. 기분 나빠지고, 우울해지면 좋아하는 거 떠올리면서 기분 조절 잘하고 끝까지 좋은 일 가득할 수 있길 바라요! 그리고 모든 게 끝나는 날, 나랑 커뮤 뜁시다",2019-09-29,07:43:48,0,1,
maru__Ssul,https://twitter.com/maru__Ssul/status/1178213771560411137,"7. 열심히 플러팅 치고 있지만 이미 당신은 다른 사람에게 플러칭 치고 있더군요. 그래서 제 플러팅은 끝내기로 했어요. 매번 하고 싶은 말은 그냥 해버리니까 익명으로 사실 할 말이 얼마 없네요. 익명님도 바쁠 시기, 몸 상하지 않게 관리 잘하고 날이 많이 추우니까 감기 조심해요",2019-09-29,07:43:47,0,1,
woojy1217,https://twitter.com/woojy1217/status/1178213680841838592,알겠어요!!ㅎㅁㅎ ㅜㅜ지금 감기 걸릴랑말랑 감기기운돌구있는상태라 넘 힘도러요ㅜㅜ 모모두 꼭꼭 겉옷 챙기구요!!,2019-09-29,07:43:26,0,0,
SVT_061108,https://twitter.com/SVT_061108/status/1178213626055774208,저도 감기 걸렸어요... 조심하고 잘 보고 오세요,2019-09-29,07:43:13,0,0,
mari_angry,https://twitter.com/mari_angry/status/1178213527464529921,감긴가... 몸이 계속 으슬으슬한디,2019-09-29,07:42:49,0,1,
JET_OW_,https://twitter.com/JET_OW_/status/1178213478214979584,"감기 몸살이라니 나 울ㅇㅓ,,,,,,,, pic.twitter.com/KAUisLElWj",2019-09-29,07:42:38,0,0,
zldpfmzp,https://twitter.com/zldpfmzp/status/1178213255946194945,"나는 작년 5월, 토요일 답사 행사로 15000보를 걸은 후 그 다음날 일요일부터 미열이 느껴지기 시작. 월요일도 열이 올라서 감기인가보다 하고 테라플루 먹음. 차도 없이 몸살기까지 생겨서 수요일에 회사 앞 내과를 감. 내과에서 몸살이라고 주사 놔주고 약을 줬지만 약 먹어도 차도가 없었음.",2019-09-29,07:41:45,0,0,
pazi_azorar,https://twitter.com/pazi_azorar/status/1178212671797071872,감기로 고생 좀 하는 위도우메이커 보고싶다. 전에 있던 일 꺼내 한참 꿍얼거리던 트레이서의 입이 굳어버린건 미지근한 이마와 끈적한 숨이 목에 닿았기 때문이여라. 공기가 더워지는 듯한 착각에 작게 기침을 하다 많이 아프냐고 물으니 고개만 끄덕이고,2019-09-29,07:39:25,0,0,
Good_Mewb,https://twitter.com/Good_Mewb/status/1178212567174373376,감기 안 나은 상태로 알바 가려니까 죽을맛...,2019-09-29,07:39:00,0,0,
seto_Nyuri,https://twitter.com/seto_Nyuri/status/1178212504054333440,이런 저런 아르바이트로 조금 바쁘지만 괜찮슴다! 건강해서요! =ﾟ∀ﾟ)ﾉ 요즘 날이 꽤나 추워졌네요. 가게에도 감기나 비염으로 고생하는 손님들이 늘었슴다. 유리 씨는 건강 잘 챙기고 계신 검까!!,2019-09-29,07:38:45,0,0,
zipnorutza,https://twitter.com/zipnorutza/status/1178212332192686080,이번셤은 아직 안받았지만 시험은 2주남앗고 감기기운이 있지 뒤져라 내몸,2019-09-29,07:38:04,0,0,
cuty_arm,https://twitter.com/cuty_arm/status/1178212286646775809,응응ㅇ 목감기 코감기 걸렸어,2019-09-29,07:37:53,0,0,
JUN_from_june,https://twitter.com/JUN_from_june/status/1178212266337980416,"8ㅁ8 감기로 하루종일 골골대다가 드디어 출발,,, 보고 싶어 스ㅔ븐틴,,,",2019-09-29,07:37:49,0,3,
shhong333,https://twitter.com/shhong333/status/1178212251704016901,감기조심하세요..!,2019-09-29,07:37:45,0,0,
cheddar_U,https://twitter.com/cheddar_U/status/1178212089774497793,이게 빨리감기여서 그렇지 이 뒤에도 정신 차리는데 꽤 걸림 잠 좀 빨리 깨자ㅠㅠㅠㅠ오늘은 커피 안 돼,2019-09-29,07:37:06,0,0,
bonjaem,https://twitter.com/bonjaem/status/1178212085273989121,엄빠 : 어제 몇시에 왔냐 : 12시? 감기걸렸다 아빠 : 어디갔다왔냐 : 재민이 보러 경복고랑 광화문 엄마 : 이수만이 경복고 나왔대 아빠 : 그 시절에는 경복고가 어쩌구....,2019-09-29,07:37:05,0,5,
zoojoy93,https://twitter.com/zoojoy93/status/1178212002688159744,"여러분 감기 조심하세용 ,,,,, 일교차 큰데 얇게 입고 돌아다녔다가 ,,, 감기 걸려버렸네요 주륵 ,,,,",2019-09-29,07:36:46,0,1,
cuty_arm,https://twitter.com/cuty_arm/status/1178211961680486400,저 근디 못감기 걸렸어여 pic.twitter.com/ARAKF5BUiX,2019-09-29,07:36:36,0,6,
13TH_MONTH_cpp,https://twitter.com/13TH_MONTH_cpp/status/1178211931779256320,"태양: 로움이가 컨디션 안좋은 목소리로 ""감기인가"" 하고 중얼거리니까, 권혁이 ""물 줘?"" ""아, 고마워"" 같은 얘기를 하고 있길래, 나도 가서 ""감기가 유행인가봐~. 나도 몸이 좀.."" 라고했더니 ""옮으니까 이쪽으로 오지 말아줄래"" 라고. 야, 좀.",2019-09-29,07:36:29,0,0,
sasakihumio,https://twitter.com/sasakihumio/status/1178211919422844928,ㅠ.ㅜ 저도요.. 연하연상 붙어먹으면 일단 80은 감기는것같아요,2019-09-29,07:36:26,0,0,
plz_tellmy___e,https://twitter.com/plz_tellmy___e/status/1178211905405456384,(물끄럼) 감기는 아냐. 운 건 아까고... 쇼가 가져다주지 않아도 괜찮아. ...밥 먹고 싶다. (체력딸림...),2019-09-29,07:36:23,0,0,
D_Chun2,https://twitter.com/D_Chun2/status/1178211899499876353,"#트친소 #목소리가_취항이면_RT #녹음러_트친소 AKMU - 「어떻게 이별까지 사랑하겠어, 널 사랑하는 거지」 감기 걸려서 코맹맹이 소리가 나고,,, 화음도 뜬금없지만 없는 것 보단 나아서 넣었서요... 못 불렀지만 그래두 올려봅니다 흔적 남겨주시면 RT 위주로 찾아뵙도록 하겠습니다 pic.twitter.com/aADiLK04Lz",2019-09-29,07:36:21,191,186,
ukimura_inabot,https://twitter.com/ukimura_inabot/status/1178211857053544448,"""감기걸릴만큼 추운날은, 가끔 연습하기싫다..""",2019-09-29,07:36:11,0,0,
nadoIDleeta,https://twitter.com/nadoIDleeta/status/1178211849642237953,감기 걸렸나봐. 스구루도 옮아라.,2019-09-29,07:36:09,0,0,
melissa0404_,https://twitter.com/melissa0404_/status/1178211808387010560,...감기 시야전조 편두통 생리통 등등의 이유로...,2019-09-29,07:35:59,0,0,
GyeongvelyU,https://twitter.com/GyeongvelyU/status/1178211745677971456,자갸...감기아니양? 나 감귀...기침 미쳐부러서ㅠㅠ,2019-09-29,07:35:44,0,0,
grandyoukan,https://twitter.com/grandyoukan/status/1178211722668081153,"한동안 컨디션 진짜 좋았는데, 감기 한방으로 하루하루 약먹고 버티면서 마감하는 나날... 여러분, 감기 조심하세요 ㅠㅠ",2019-09-29,07:35:39,1,5,
fuckandlikeyouO,https://twitter.com/fuckandlikeyouO/status/1178211710101901312,"참나, 어따 써먹을데도 없을 호구새끼.. 니새낀 뭘 했다고 감기나 쳐 걸리고 지랄이냐?(주머니에서 감기약 꺼내 툭 던지며)씨발. 그거 쳐 먹고 잠이나 쳐 자라 새꺄",2019-09-29,07:35:36,0,0,
kaju_bbo,https://twitter.com/kaju_bbo/status/1178211641105608705,감기몸살인듯 자라,2019-09-29,07:35:20,0,0,
puze18,https://twitter.com/puze18/status/1178211518522916864,오.. . . . 시험날감기~ 도저히책상에앉아잇을수가없어서안방에서이불덮고엎드려서공부중임.. . . 으슬한거말곤건강한데ㅁ도렋음 https://twitter.com/GradYamaOut_Oct/status/1178211209893404673 …,2019-09-29,07:34:50,0,0,
BLISAIDE,https://twitter.com/BLISAIDE/status/1178211506359603200,아 얇게입고잤다가 감기더도졌어 시발 감깃균 윤석열한테 옮아라,2019-09-29,07:34:47,0,0,
yeoul_0326,https://twitter.com/yeoul_0326/status/1178211400306454528,아 감기 걸려버렸다,2019-09-29,07:34:22,0,0,
gamer_simiru,https://twitter.com/gamer_simiru/status/1178211296438669312,머리아프고... 목도 아프고... 치킨이 안땡기는걸 보면 극심한 감기다,2019-09-29,07:33:57,0,0,
SUB_SIK_1109,https://twitter.com/SUB_SIK_1109/status/1178211251232501760,#ㅇㅅㅈㅇㅇ 나 지금 감기랑 그날이랑 겹쳐서 너무 아파...... pic.twitter.com/EFJrJ8rxbn,2019-09-29,07:33:47,0,0,
Nami_Natsumi,https://twitter.com/Nami_Natsumi/status/1178211219305451520,저는 괜찮습니다. 감기에 걸려본 적이 없을 정도로 튼튼하거든요!,2019-09-29,07:33:39,0,0,
GradYamaOut_Oct,https://twitter.com/GradYamaOut_Oct/status/1178211209893404673,그거 곧 감기걸린단소리야 빨리 기력보충하고 뜨순데 들어가 https://twitter.com/puze18/status/1178211030695989249 …,2019-09-29,07:33:37,0,0,
ritsuka_for_you,https://twitter.com/ritsuka_for_you/status/1178211055475904513,요즘들어 날이 더워. 잘못하다가 감기 걸리는 게 아닌지 몰라.,2019-09-29,07:33:00,0,0,
GM_CH_MENTS,https://twitter.com/GM_CH_MENTS/status/1178210868326060032,너 감기기운 있어 보이길래 그냥 차 타 왔는데. 독 안 넣었거든?,2019-09-29,07:32:15,0,0,
eycwiGdkcm45VAR,https://twitter.com/eycwiGdkcm45VAR/status/1178210856921792512,감기약 드셨어요?,2019-09-29,07:32:13,0,0,
BS_C_topper,https://twitter.com/BS_C_topper/status/1178210828526354432,현재 진행 상황은 임시 시안을 내본 뒤 수정 요청을 하려는 단계입니다. 내일인 9월 30일부터 다시 꾸준히 진행 정보를 업로드하겠습니다. 모쪼록 조직원 여러분들은 환절기 감기와 기타 계절성 질환을 조심하시길 바랍니다. 감사합니다!,2019-09-29,07:32:06,1,1,
HopePolaris_218,https://twitter.com/HopePolaris_218/status/1178210807865151488,텐션 뭐야 ㅋㅋㅋㅋㅋㅋㅋ 빨리감기 한줄 알았어 ㅋㅋㅋㅋ https://twitter.com/TiktokKR/status/1178206711342977026 …,2019-09-29,07:32:01,2,23,
lesbos_pyree,https://twitter.com/lesbos_pyree/status/1178210801229783040,왜 이렇게 더운지 설명해주실분 날씨가 감기걸렸나,2019-09-29,07:31:59,0,0,
CHC_1025,https://twitter.com/CHC_1025/status/1178210737992294400,탐라에서 송태원 간호하는 그런 걸 봐버려서... 송태원이 한유진 품에 꼭 넣고 간절하게 빨리 나으세요. 바스라지면 안됩니다. 하면서 머리카락 쓰다듬고 허리 토닥이는 것이 보고싶어. 열감기뿐이지만 놓치고 싶지 않다며 집착하는 송태원 그런 거,2019-09-29,07:31:44,4,13,
narsha118,https://twitter.com/narsha118/status/1178210680383557632,ㅠㅠ 카페왓는데 카페라떼를 못먹어 ㅜㅠㅠㅠㅜ 감기 빨리나아야먹는데,2019-09-29,07:31:30,0,0,
yongdal____blue,https://twitter.com/yongdal____blue/status/1178210485457448962,헐 저두 완전 열많아 인간이라 ㅜ.ㅜ 구래서 맨날 환절기 감기 다 걸리구 ㅠㅠ 흑흑 오늘 코트각이다 싶으면 오삼님께 호닥닥 멘션날리께요 ㅠㅠ,2019-09-29,07:30:44,0,0,
Yazawa_NicoS2,https://twitter.com/Yazawa_NicoS2/status/1178210403106426880,""" 가슴이 조금씩 두근거리는 건 분명 기분 탓 …… 아니 , 감기 탓이라고 니코는 생각해 . """,2019-09-29,07:30:24,0,0,
sugarmixup,https://twitter.com/sugarmixup/status/1178210333002846209,온준영 다 잘 해도 머리는 잘 안 말리면 좋겠다. 금방 마르니까 그냥 두는데 감기 걸린다고 말려주는 한정우.,2019-09-29,07:30:08,3,7,
flatten__,https://twitter.com/flatten__/status/1178210322932363269,"나를 다시 보고싶을 때는, 010하고 아무 번호나 누르고, 끝은 417로 해요. 그럼 내가 나 부르는구나 하고 생각할게요. 말도 안되는 소리. 용섢이 그 말갛던 얼굴을 떠올리며 이불을 당겨덮었다. 그 날 이후로 감기몸살에 걸린 것이었다. 분명히 비는 한방울도 안 맞았는데.. 이상한 일들 투성이였다.",2019-09-29,07:30:05,0,7,
Ven_9191,https://twitter.com/Ven_9191/status/1178210287670808576,으어...감기걸릴라나봐..ㅜㅠㅠ,2019-09-29,07:29:57,0,1,
suhjohncat,https://twitter.com/suhjohncat/status/1178210196696395776,여름 감기 비망록 http://posty.pe/xbeivq #태도 #툥도 #용영 #postype,2019-09-29,07:29:35,0,1,
CrioxdC,https://twitter.com/CrioxdC/status/1178210115482079236,감기 걸렸어....약 먹으니까 졸려,2019-09-29,07:29:16,0,0,
_Nala_WIC,https://twitter.com/_Nala_WIC/status/1178210072385556480,그러게~ 요즘 점점 더 추워지는거 같은걸~? 제이도 감기 조심해~! (너에게 웃으며 핫팩 하나를 건내),2019-09-29,07:29:05,0,0,
kyoka_left_cpp,https://twitter.com/kyoka_left_cpp/status/1178210025149321216,"*콤비 다자:요새 쿄카 양이 내내 반팔티만 입고 다니던데.많이 덥나? 츄야:뭐?그러다 감기 걸리면 어쩌려고... 다자:뭐 어떤가,나도 반팔티 입고 다니는데~ 츄야:?어쩌라고.",2019-09-29,07:28:54,1,8,
Eon_0720,https://twitter.com/Eon_0720/status/1178209710857547776,지쳐서 눈도.......반쯤 감기고... 더워 죽어ㅠㅠ,2019-09-29,07:27:39,0,0,
RST_CPP,https://twitter.com/RST_CPP/status/1178209681258381312,"미도리: 저 편의점 다녀와도 됨까? 스바루: 왜? 미도리: 모리사와 선배 감기잖슴까 마스크 사올게여 스바루: 오,타카밍 착한걸~ . . . 미도리: 다녀왔슴다 스바루: 엣..왜 마스크 하고 있는거야 미도리: 에,그치만 모리사와 선배 감기잖아요 스바루: ?????? 미도리: 자 선배도 마스크 끼세여.. 치아키:",2019-09-29,07:27:32,0,1,
L_Dream_ing,https://twitter.com/L_Dream_ing/status/1178209471572561920,충동적으로 우산이고 뭐고 없이 무작정 밖으로 나가 비를 맞았을 거 같아요. 마틴이랑 하랑이 감기 걸린다고 기겁했지만 테이는 되려 그 모습을 안타깝게 보았을 것 같습니다. 자유를 있는 힘껏 만끽하고 있구나. 라고 느꼈을 것 같네요. 캐럴이랑 아스카에게 이 날은 굉장히 특별한 날이에요. 서로의,2019-09-29,07:26:42,0,0,
you_re_notalone,https://twitter.com/you_re_notalone/status/1178209430329970688,"저는 시험기간만 되면 감기가 걸리더라구요, 초등학교 1학년때부터 그랬어요. 정말 아파서 쉬고싶은데 공부는 해야해서, 공부할 땐, 정말 너무 서러워요. 그냥 그렇다구요",2019-09-29,07:26:32,0,1,
__Thirst_,https://twitter.com/__Thirst_/status/1178209362365468672,ㅋ ㅅㅂ ㅋ 애색기 귀여버죽것어 아주그냥..ㅋ 울똥강아지 ㅋ 감기는안돼니게 ㅋ 마스크 위로만 부벼 (ㅋ,2019-09-29,07:26:16,0,0,
JH_hell,https://twitter.com/JH_hell/status/1178209142126694400,...?¿ ..감기 걸렸니 도깨비씨?,2019-09-29,07:25:24,0,0,
Stsd_ois,https://twitter.com/Stsd_ois/status/1178209138532175873,모야 감기 걸리셨어요 ㅠㅜㅠㅜㅜ???? 안돼... 제 감자들 입에 다 넣고 푹 쉬세요,2019-09-29,07:25:23,0,1,
Boundary_sin,https://twitter.com/Boundary_sin/status/1178208938187116544,감기 옮겼다.,2019-09-29,07:24:35,0,0,
OC3AN13LUE_,https://twitter.com/OC3AN13LUE_/status/1178208889818402816,저는 방금 감기약을 김우진처럼 털어넣고 오는길,2019-09-29,07:24:24,0,3,
oyo_09,https://twitter.com/oyo_09/status/1178208835078508544,ㅋ ㅋ ㅋ ㅋ ㅋ ㅋㅋㅋ아 넘 귀여워요...진짜....둘다 넘 감자같아요ㅋ ㅋ ㅋㅋㅋㅋㅋㅠㅠㅠ샌님 연성 덕분에 감기가 다 나은 거 같아요 최고에요,2019-09-29,07:24:11,0,0,
podonct,https://twitter.com/podonct/status/1178208782637121538,"나제민 감기 걸리면... 심한 거 아니고 걍 감기기운 있는 정도인데 이동역 혼자 엄청 난리쳐.. 이동역이 억지로 눕혀놓은 몸 일으키면서 아니 동역아 나 진짜 괜찮, 까지 말하다가 다시 눕혀져서 그대로 이마에 물수건 대고있는 나제민 ㅅㅂㅋㅋ",2019-09-29,07:23:58,8,25,
OC3AN13LUE_,https://twitter.com/OC3AN13LUE_/status/1178208559869227008,엉엉 감기걸려서 온몸 욱신욱신아퍼 건강하세요 트위터칭구들,2019-09-29,07:23:05,0,2,
mavi1diz,https://twitter.com/mavi1diz/status/1178208518853152770,아 그리고 머리를 아주 길게 길러보기로 했다 숱이 많아서 감기 힘드니까 층을 많이 쳐서 길이만 길게 해볼까 생각 중... 긴 머리 해본지 정말 오래됐는데 내가 참을 수 있을지 잘 모르겠네ㅋㅋㅋㅋ,2019-09-29,07:22:55,0,0,
color8838,https://twitter.com/color8838/status/1178208497881636866,감기때문에 안배고픔 속이 조금 아프고 머리도 멍하다 의사쌤한테 그냥 머리도 아프다고 할껄,2019-09-29,07:22:50,0,0,
Perfbutler_bot,https://twitter.com/Perfbutler_bot/status/1178208460258729986,요즘은 날씨가 많이 춥습니다. 감기 걸리지 않게 조심하십시오.,2019-09-29,07:22:41,0,0,
Butter_fly_ON,https://twitter.com/Butter_fly_ON/status/1178208450083377152,감기 조심,2019-09-29,07:22:39,0,0,
jinbouri,https://twitter.com/jinbouri/status/1178208297813499905,"감기몸살로 병원에 갔더니 '아버님 열 좀 재보실게요~' 흠칫해서 봤더니 '아, 아버님이 아니고 애기가 아픈가봐요~' z(-_-)s",2019-09-29,07:22:02,0,0,
